Id	Instance	Markers	New.Gold.Label
2032	YORK City’s FA Trophy top scorer Daniel McBreen is targeting a Wembley win to compensate for a sorry league season.	['N/A']	EN-GB
1376	"When Towson University senior Gregg Davies graduates later this month, he will enter the real world with an impressive academic standing likely to receive notice."	['N/A']	EN-US
2161	"Ivanka Trump sent hundreds of emails last year to White House aides, Cabinet officials and her assistants using a personal account, many of them in violation of federal records rules, according to people familiar with a White House examination of her correspondence."	['N/A']	EN-US
215	":49 Apple is selling a pretentious coffee table book for $300 One of the latest Apple products, a $300 book, might be one of their strangest. It contains just pictures of Apple products, so this is probably only to appeal to diehard fans of the company."	['N/A']	EN-US
772	OXFORDSHIRE’S hopes of defending their title are hanging in the balance after they suffered a frustrating 18-17 defeat against Essex.	['N/A']	EN-GB
1450	THREE young girls were reduced to tears when police accosted them for picking daffodils in a Poole park.	['N/A']	EN-GB
1906	"The battle has raged for generations, spanning worlds and even species, pitting families and friends against one another. It defies logic and science, though it was forged from both. And just when it seems fated to end, a new leader emerges from the wreckage."	['N/A']	EN-US
2714	THE Anglo-Welsh Cup gives a chance for the next generation to experience senior rugby and it will be interesting to see how our young duo Leon Brown and Harri Keddie go at Leicester tomorrow.	['N/A']	EN-GB
1261	A TEA party to celebrate the 70th anniversary of the NHS attracted dozens of people to the garden in Darlington Memorial Hospital.	['N/A']	EN-GB
341	CHINNOR opened up a 12-point gap over third-placed Redingensians as they beat the Berkshire club 31-29 away from home.	['N/A']	EN
1823	"SAXTON Rovers came from behind to claim all three points and keep their North Berks League Division 1 title hopes alive with a 2-1 victory over leaders Berinsfield in front of more than 100 spectators, writes RICHARD UNDERWOOD."	['N/A']	EN-GB
1742	CHEPSTOW Racecourse has been busier than ever lately due to being allocated two fixtures from Bath.	['N/A']	EN-US
379	FAMILY fun transferred seamlessly into evening entertainment as the first ever Didcot Summer Fayre provided something for everyone.	['N/A']	EN-GB
2954	"The lawyer for Deborah Ramirez, the second woman to accuse Supreme Court nominee Brett Kavanaugh of sexual misconduct, said she wants to testify in front of the Senate Judiciary Committee but that the committee were not interested in hearing her speak. Meanwhile, President Donald Trump remained in staunch defense of his nominee, calling the accusations a ""con job."" (Published Wednesday, Sept. 26, 2018)"	['supreme court']	EN-US
2080	"BOSSES at the Sandy Balls resort told disappointed holidaymakers they had ""little option"" but to build new lodges on land currently used by visiting campers, caravanners and motor home owners."	['N/A']	EN-GB
2542	SAN FRANCISCO — Giants catcher Buster Posey will miss the All-Star game because of a lingering right hip issue that needs an injection to calm the inflammation.	['N/A']	EN-US
1004	"The story of the Baltimore Fire, which raged for two days beginning Feb. 7, 1904, really has little to do with the fire itself, with the fact that it destroyed 70 city blocks, left 35,000 people without jobs or ruined more than 1,500 buildings."	['N/A']	EN-US
518	"IRON-AGE entrepreneurs in the North-East proved their salt by recycling bronze coins and making trinkets to sell back to soldiers in the Roman Army, according to experts."	['N/A']	EN
2389	"YORK City Knights boss James Ford watched his side destroy London Skolars and then declared this season's Betfred League One to be the ""most exciting"" he's known."	['N/A']	EN-GB
1105	"HUNDREDS have turned out to help raise thousands of pounds for local causes at a tucked away village fete, hidden just a mile from the teeming Botley Road."	['N/A']	EN-GB
2632	"A Hampshire mother has criticised mental health staff after she pleaded for help for her mentally ill son, who died when he plunged in front of a train."	['N/A']	EN-GB
879	The Albany Northern League have accepted an invitation from Darlington chairman George Reynolds to stage next year's Albany Northern League cup final at Neasham Road.	['N/A']	EN-US
386	"A BLIND spot created by a mobile phone holder in a delivery driver's windscreen was 'the only thing that could have obscured' his view of a hairdresser before he ran her down, a jury has been told."	['N/A']	EN-GB
276	PLANS are underway to create a permanent hub for children’s sleep workshops at a Bournemouth primary school.	['N/A']	EN-GB
2715	"A CHAMPAGNE-SOAKED Darlington manager Martin Gray described winning the Northern League title as the proudest moment of his career last night, after his team finished the season in style."	['northern league']	EN-US
2800	"In the closing weeks of their run for Congress, Andy Harris and Frank Kratovil have claimed a wish to get away from negative campaigning."	['N/A']	EN-US
1067	Residential remodelers spent more than $300 billion nationwide in 2018. And industry forecasts call for an increase in home redos and repairs this year.	['N/A']	EN-US
2095	"MORE people in Wales are surviving a stroke and stroke services across the country are improving - but more remains to be done, according to the latest progress report from the Welsh Government."	['N/A']	EN-GB
1241	"Three years ago, Lewis Schrager stood at the grave of Rachel Levy, a Jewish woman buried at Monticello, and was somewhat confused. Schrager, a closet historian, couldn't figure out why Levy and her family were buried at Jefferson's estate. After doing some research, Schrager uncovered the story of the Levy family and became thoroughly enthralled."	['N/A']	EN-US
1759	Leggy models in Christian Louboutin heels and Wolford stockings glide from room to candlelit room. A dapper man in a custom suit eyes them while sipping Champagne by the mansion’s fireplace. A DJ plays in a corner. Oysters are slurped at the bar.	['N/A']	EN-GB
1401	RESIDENTS have said the £1m revamp of a city community centre is ‘unsafe’ after spotting tools left out and walking down stairs with no rails.	['N/A']	EN-GB
1725	"NEW YORK -- Goldman Sachs Group LP's Jon Corzine stepped down yesterday as co-chief executive, ceding control of the biggest investment banking partnership after withdrawing a plan to sell stock to the public and losing hundreds of millions of dollars in bond trading."	['N/A']	EN-US
1126	"Michael G. Puinno, a pancreatic cancer survivor who lived with the disease for a remarkable eight years and inspired others with his giving spirit and sunny disposition, died of heart failure Sunday in his home in Niagara Falls, Ont. He was 58."	['N/A']	EN-US
650	"SURPRISE, Ariz. -- This may be the camp of good feelings, but the period of everybody feeling good is officially over for the Rangers."	['N/A']	EN-US
2976	WASHINGTON — The Pentagon on Thursday ordered a temporary pause in all F-35 fighter jet flights in order to inspect the fleet in the wake of a crash last month in South Carolina.	['washington']	EN-US
325	A WOMAN from Newport has spoken of her shock at the “lack of compassion” she claims was shown by an out-of-hours vet service.	['N/A']	EN-GB
1796	"BUMPER crowds are expected for the 26th Swanage Folk Festival, when it gets underway next month."	['N/A']	EN-GB
2156	Scott Pruitt has repeated a particular line again and again since becoming the head of the Environmental Protection Agency.	['N/A']	EN
2402	A Japanese spacecraft has touched down on a distant asteroid on a mission to collect material that could provide clues to the origin of the solar system.	['N/A']	EN
2278	NEWPORT County AFC boss Michael Flynn insists that just because plans are being put in place for next term doesn’t mean he is “writing off” this season and a late bid to reach the play-offs.	['N/A']	EN-GB
1065	MP DAVID Davies has become embroiled in a row with a pro EU campaign group after an angry confrontation with a protestor outside the Houses of Parliament.	['N/A']	EN-GB
1952	Activists who believe that minority viewers will be undercounted by a new Nielsen television ratings system launched a group to protest the technology yesterday.	['N/A']	EN
1872	"Whether it was the first synthetic adhesive produced in 1869 or the ""super glues"" of today, glues or adhesives have one purpose: They bond two solid materials together."	['N/A']	EN-US
2844	THE biggest factor in the public disengagement from politics is the mass mistrust that parties will stick to their promises.	['N/A']	EN-GB
2755	"ATLANTA -- If the U.S. Supreme Court upholds Indiana's harsh voter ID law, as its justices seem poised to do, hundreds of thousands of black Americans should march in protest. So should hundreds of thousands of Latino Americans. Native Americans, too. Political activists from across the ethnic spectrum should convene the biggest political demonstration since the historic March on Washington in 1963."	['N/A']	EN-US
1394	"Twenty minutes before tipoff in a tunnel leading to the Gentile Arena basketball court, towering Loyola players formed a circle around a 98-year-old nun as she quietly prayed."	['N/A']	EN-US
2130	"A crash destroyed the home business of a psychic in Anaheim. Robert Kovacik reports for NBC4 News at 11 p.m. on Friday, Feb. 12, 2016. (Published Monday, Feb. 15, 2016)"	['N/A']	EN-US
69	OXFORD City manager Mark Jones has started making changes to his squad after being handed a reduced budget for next season.	['N/A']	EN-GB
732	"A pancake house, which includes a self dispense bar and is thought to be the largest in the UK, is set to be the newest edition to Glasgow's thriving food and drink scene."	['N/A']	EN-GB
1323	"If money is no object and you’ve always dreamed of an impressive, sprawling stately home, then take a look at Romanach House in Inveresk Village Midlothian."	['N/A']	EN-GB
1284	"TEN years ago, the Archbishop of York, Dr John Sentamu, cut up his dog collar on The Andrew Marr Show as a symbolic protest over Robert Mugabe’s leadership of Zimbabwe."	['N/A']	EN-GB
1824	"Dear Abby: I have been married for 21 years, and the past eight or 10 of them haven't been good. I have tried to get my wife to go camping, out to dinner or to bluegrass concerts we both love. I can't convince her to do any of these things with me. But when her sister calls wanting her to go somewhere, she's gone and stays out all day."	['N/A']	EN-US
448	WHAT the devil? The actor who played one of Coronation Street’s most infamous villains is to play Satan in York’s Mystery Plays this summer.	"['coronation street’s', 'coronation street']"	EN-GB
492	"A FORMER LV= employee offered an ex-colleague £3,000 a month to send him the details of customers involved in road accidents."	['N/A']	EN-US
2979	"A MAN drove to the New Forest and killed himself after being accused of a historic sex offence, an inquest heard."	['N/A']	EN-GB
558	"Scattered among the $500 to $1,000 desktop computers available at Walmart.com, one machine stands out. It doesn't have a unique design, but its price tag looks like a typo: $199."	['N/A']	EN-US
1985	"WASHINGTON (AP) — More Americans feel Barack Obama’s presidency divided the country than feel it brought people together, a new poll shows. Yet he leaves office held in high esteem by a solid majority."	['N/A']	EN-US
1603	"Welcome to the Twilight Zone: Under immunity deals given to two key Hillary Clinton aides in the e-mail probe, the FBI wound up destroying evidence."	['N/A']	EN-US
1481	Life had been unraveling for paramedic Bryce Reed even before the fire and explosion that ripped apart his town.	['N/A']	EN
1364	"PLANS to build more than 400 homes, a hotel and a supermarket in West Parley have been described as “horrific” by hoardes of angry residents"	['N/A']	EN-GB
470	"In an unprecedented move, seven Texas chambers of commerce, two pro-business consortiums and four prominent companies – including Southwest Airlines and Marek Brothers Construction – have filed a brief in federal court asking a judge to reject state Attorney General Ken Paxton’s lawsuit to scrap a program that shields certain young undocumented immigrants from deportation."	['texas']	EN-US
2613	POLICE are launching a new pilot scheme offering crime prevention advice to buyers of quad bikes.	['N/A']	EN-GB
385	"Two weeks ago, the Judicial Council of the U.S. Court of Appeals for the 10th Circuit dismissed 83 judicial misconduct complaints filed against Brett Kavanaugh in connection with his nomination to the Supreme Court. The identities of the complainers have been kept secret, but nothing prevents them from coming forward. I am coming forward. I’m one of those 83 complainers."	['N/A']	EN-US
1490	"Over the course of the operation I received hundreds of messages, tweets and emails of inquiry, encouragement and support. They all helped. I maintain an active Twitter feed and have worked in the public information officer role on more than one occasion, but I no longer serve in that function. I teach courses on crisis communications and effective social media use during critical incidents. It's important, and I felt the support from the community and from friends during this crisis. I was thankful."	['N/A']	EN-US
740	"Sloth: The Dutch work the fewest hours each year (1,381 per worker on average), while Mexicans work the most (2,226), among OECD countries. The French spend the most time eating and sleeping — snoozing for over an hour longer each night than South Koreans, who get the least sleep."	['N/A']	EN-US
1545	Can you tell us about your 30th Anniversary tour Juggling On A Motorbike and what audiences can expect?	['N/A']	EN-US
2661	A CORONER says lessons must be learned after failings were identified following the death of a vulnerable woman who was let down by her health trust.	['N/A']	EN-GB
1896	"A WOMAN may have killed herself because she couldn't stand living without her dog, an inquest heard today."	['N/A']	EN-GB
687	"The Carroll County Family YMCA is sponsoring its annual ""Keep Families First"" support campaign."	['N/A']	EN-US
2600	"It is hard to imagine a true-crime docu-series that has more winning story elements than ""The Keepers."""	['N/A']	EN-US
1772	AN INVESTIGATION has been launched after two hamster were 'thrown out the window of a moving car' in Winchester.	['N/A']	EN-GB
1032	Kathryn Roberts tells Tim Hughes that she loves her Dartmoor home but feels most at home being on the road with husband Sean Lakeman	['N/A']	EN
1446	"DUBLIN, Ohio (Reuters) - Zach Johnson joined up with his United States team mates ahead of this week's Presidents Cup despite suffering from the flu for the past three days, United States captain Fred Couples said on Tuesday."	['N/A']	EN-US
882	"An amateur geologist poking around on a desolate, rubble-strewn lot in Arbutus has stumbled across what appears to be part of a leg bone of Maryland's official state dinosaur, Astrodon johnstoni."	['N/A']	EN-US
504	"A Baltimore police officer who resigned last month after being accused of taking money from two Hispanic men acknowledged yesterday that he seized cash from one accuser, but denied shaking down a second man."	['N/A']	EN-US
1894	"ISLAMABAD, Pakistan -- A high court stacked with loyalists set the stage yesterday for Pakistan's president, Gen. Pervez Musharraf, to resign as army chief and to lead the country as a civilian, tossing out all legal challenges to his re-election last month."	['N/A']	EN-US
647	The Chicago Symphony Orchestra and the Grant Park Orchestra remained true to their respective festival brands in their weekend concerts.	['N/A']	EN-US
1989	"A new medical device, backed by former MLB all-star pitcher Mariano Rivera, treats chronic pain with a low-level, low-frequency ultrasound and purports to be a drug-free solution to combating the opioid crisis."	['mlb all-star pitcher']	EN-US
626	"Half the streets are unpaved, and more lack sidewalks. There's only one park and no community centers. There's no direct bus route downtown. There's no library. Stores are few and far between. Schools are crowded and in need of repair or replacement. That's the grim picture of the Cully-Concordia area painted by a new report by the city's Planning Bureau and Portland Public Schools. The city and the school district are working together to find ways to improve the neighborhood and its schools. ""Strong schools and strong neighborhoods are inexorably linked,"" says Debbie Bischoff, senior planner in charge of the project. The plan presented to the City Council last week includes 36 recommendations, from improving after-school activities to increasing commercial zoning. But the only specific action the council approved was spending $15,000 on classes for adult English language learners. According to the 2000 Census, 22 percent of the area's population spoke a language other than English at home. The rest of the plan aims to guide decisions by the city, the school district and other local governments. The report grew out of an initiative launched by former City Commissioner Erik Sten to explore the links among housing, families and schools. It's not news that central Northeast neighborhoods are increasingly home to low-income residents and that they lack services. What's new is the level of cooperation between the city and school district. The report examines neighborhoods served by three public elementary schools: Faubion, Rigler and Harvey Scott. All three are crowded, with enrollment fueled by population growth, school consolidation and the addition of sixth and seventh grades. Even so, the schools attract a smaller share of neighborhood students than district schools overall, 60 percent compared to 67 percent. Four out of five students at the three schools were eligible for free or reduced-price lunch, compared to 50 percent districtwide. Faubion is among schools the district has targeted for replacement, though the school board has not decided whether to seek a bond. The staff has recommended an overhaul of Rigler and an expansion for Scott. A big question is what to do with the 10-acre former site of Whitaker Middle School at Northeast 42nd Avenue and Killingsworth Street. A district committee recommended putting a new middle school on part of the site and housing on the rest. ""Our intention is to use the rebuilding of Faubion, and a community process, to decide what's best for both sites,"" says Doug Capps, a spokesman for Portland Public Schools. Concordia University has proposed developing an indoor recreation facility on the site. The report shied away from specific recommendations for the Whitaker site. ""There are more ideas than room on the site, so there's going to be choices,"" says Commissioner Nick Fish, who oversees the city's housing programs. The notion of increasing commercial zoning, while attractive in principle, worries neighborhood leaders who see the threat of gentrification -- or just more of the strip clubs and bars that dominate the area's commercial areas now. ""If we were guaranteed neighborhood-friendly businesses,"" says Kathy Fuerstenau, chairwoman of the Cully Association of Neighbors. ""My fear is if you open it up, more liquor establishments will flop themselves down."""	['N/A']	EN-US
365	James Constable has turned down Oxford United's new contract offer and has joined Eastleigh on a two-year deal.	['N/A']	EN-GB
1668	"The Illinois Commerce Commission should reject Commonwealth Edison Co.`s compromise attempt to win approval for it`s rate-freeze plan and order new negotiations instead, opponents argued Tuesday."	['N/A']	EN-US
1681	The Los Angeles-based owner of properties including Tribune Tower and Block 37 has paid almost $58 million for two buildings in the Wicker Park-Bucktown area as the firm makes a push into Chicago's North Side.	['N/A']	EN-US
2529	"TOM Latham collected his second century in three games and Paul Collingwood passed 1,000 championship runs for the season as Durham piled on the runs against Kent."	['kent']	EN-GB
418	A LOT has changed for Newport County AFC in the last 12 months but the League Two table has a familiar look about it.	['afc']	EN-GB
984	Here are two excellent opportunities to learn what is really in the newly adopted Texas Social Studies standards (TEKS):	['N/A']	EN-US
2282	"LONDON -- London's glitzy West End is no longer the heart of British theater. Sure, it has the blockbusters with helicopters, crashing chandeliers and choruses of singing cats -- you know, the same megamusicals that are on Broadway."	['N/A']	EN-US
2859	"USUALLY plays that go wrong never recover. Not so with Mischief Theatre's West End, touring, Broadway and international hit The Play That Goes Wrong, the one that goes wrong deliberately, and the more it does so, the better it becomes amid the calamitous clatter."	['N/A']	EN-GB
1117	"VATICAN CITY (Reuters) - The Vatican hailed the United Nations' implicit recognition of a Palestinian state on Thursday and called for an internationally guaranteed special status for Jerusalem, something bound to irritate Israel."	['N/A']	EN
2409	Updated: GOAL hero Richard Brodie fired a sensational hat-trick to earn York City a 3-2 victory over Chester City in the Blue Square Premier.	['N/A']	EN-GB
2051	"NEARLY 5,000 children were persistently absent from secondary schools across Dorset last year, each missing at least 19 days of teaching."	['N/A']	EN-GB
2453	Environmental groups prepared for the 2014 midterm elections by asking themselves: How much money would it take to get American voters to mandate legislative action on climate change?	['N/A']	EN-US
1025	"Carmine Persico, boss of the Colombo Crime Family, poses for a portrait Sept. 15, 1986 at the Metropolitan Correctional Center in New York City during the Commission trial."	['N/A']	EN-US
309	"LOUISVILLE, KY. — Art Sherman looked dazed, perhaps still a bit uncertain that fate had handed him such a magnificent gift after six decades of devotion to racehorses."	"['louisville, ky']"	EN-US
172	UNIVERSITY marketing graduate Sam Williams aims to add considerable fire power to the promotion of a leading Gwent park	['N/A']	EN-GB
919	PIRATES asset Kyle Newman has returned to Leicester for next year's SGB Premiership campaign.	['N/A']	EN-GB
549	"It can be hard to imagine while driving through Illinois' seemingly endless expanse of subdivisions, office parks and farms, but the state still harbors some dramatic natural landscapes that have hardly been touched by human civilization. Though they're little known, some of these remnants of thousands of years of natural history are powerfully moving sights."	['N/A']	EN-US
1713	"As London-based TV producers patrolled a North-East road trying to persuade unemployed residents to take part in a new series of the controversial Benefits Street programme, Chris Webber talked to the street’s hard-working people."	['N/A']	EN-GB
2773	"KEEN volunteers who would like to help inspire visitors and locals to explore the geology of the North Pennines landscape are being offered free, expert training."	['north pennines']	EN-GB
2072	British sailor Alex Thomson believes he is unlikely to reel in his French rival despite halving the lead hours before the finish of the solo round-the-world Vendee Globe race.	['N/A']	EN-GB
1706	WE welcome Walsall to Grenoble Road this afternoon for what I am sure will be a really entertaining game.	['N/A']	EN-US
2582	WINCHESTER now has its own tribute to England as the team prepare for their World Cup semi-final against Croatia tonight.	['good']	EN-GB
2165	It’s the line from Scripture that stayed with Cait Finnegan for nearly half a century as she tried to suppress the painful memories of the sexual abuse she says she suffered at the hands of her Catholic clergy educator.	['N/A']	EN-US
1047	"COUNT Arthur Strong reflects on a life spent on stage and screen, replete with misinformation, malapropisms and expletive outbursts."	['N/A']	EN
1442	"AHEAD of Tamworth’s visit, York City boss Martin Gray hailed his squad’s attitude and hard work."	['N/A']	EN-GB
2397	Major League Baseball is expected to announce today that all of its postseason telecasts and the All-Star Game will air exclusively on Fox and its cable channels beginning next season.	['N/A']	EN-US
1859	Some real estate experts expect Congress and the Bush administration to reach an accord this year that will finally allow first-time buyers to make penalty-free withdrawals from their retirement accounts to buy a house.	['N/A']	EN-US
844	"Kralovec, Jambois & Schwartz is proud to announce that former Cook County judge John S. Fotopoulos has joined the firm as a practicing attorney. Fotopoulos Law Office, a division of Kralovec, Jambois & Schwartz, is located in Orland Park, Illinois, with a Joliet office opening soon."	['N/A']	EN-US
2722	PROMISING Newport Gwent Dragons centre Jack Dixon has been called into Danny Wilson’s Wales Under-20s squad for the IRB Junior World Championship in South Africa which takes palce between June 4 and 22.	['N/A']	EN-GB
1750	"DEVELOPERS of a multi-million pound Asda supermarket scheme have put the site up for sale, after months of uncertainty about its future."	"['pound', 'asda']"	EN-GB
2655	"Larry Barnett, the president and CEO of Midlothian Economic Development declined to say what corporation was behind Sharka LLC, which registered as a Texas business entity in January."	['texas']	EN-US
1311	Former county council planning officer David Young writes on how Oxfordshire could change for the worse.	['N/A']	EN
