Id	Instance	Markers	New.Gold.Label
203	"After an interruption of nearly 30 years, movies will once again play at Pikesville's Pikes Theatre beginning Friday."	['N/A']	EN-US
274	"CHARLOTTESVILLE, Va. -- Rescue operations commenced at University Hall last night, and just when Maryland needed it most, Keith Booth saved the day -- if not the season."	['N/A']	EN-US
1326	"THE vicar of St Mark’s Church, Gold Tops, Newport, believes there are grounds for optimism in an increasingly difficult time for the church."	['N/A']	EN-GB
1339	An old-school downtown Dallas real estate development will be home to a new-generation business hub.	['N/A']	EN-US
154	AUTHORITIES in Oxfordshire have been praised for their reforms to tackle child sexual exploitation in the wake of the Bullfinch child abuse scandal.	['N/A']	EN-GB
1196	"Even Treasury Inflation Protection Securities - pretty tame as investments go - haven't escaped market ugliness. But now that they've been beaten down, they look attractive for long-term investors."	['N/A']	EN-US
2410	"It was another fourth quarter implosion Sunday by the Trail Blazers, this time a 13-point lead gone in an instant to Memphis, and while the team wanted to point to LaMarcus Aldridge's absence and coach Terry Stotts wanted to credit the Grizzlies' defense, we all know it really came down to one word:"	['N/A']	EN
2333	A COMPUTER engineer died of massive injuries after lying across a track in front of an oncoming train.	['N/A']	EN-GB
1252	"Westell Technologies Inc., an Aurora-based telecommunications firm, will acquire Teltrend Corp., a telecommunications-equipment company based in St. Charles, in a deal valued at about $205 million."	['N/A']	EN-US
1987	"U.S. border inspectors allowed some of the Central American asylum-seekers to enter the country for processing, ending a brief impasse over lack of space. But the migrants who crossed Mexico in a caravan may face a long legal path."	['N/A']	EN-US
1729	A criminal justice study group Tuesday echoed previous calls for the systematic screening of all Cook County drug cases in order to conserve valuable court time and other judicial resources.	['N/A']	EN-US
95	DETECTIVES investigating a series of cashpoint raids across the North last night said lives are being put at risk.	['N/A']	EN
242	YORK’S famous choirgirl Isabel Suckling has teamed up with a Bee Gee to mark the 100th anniversary of the sinking of the Titanic.	['N/A']	EN-GB
2247	"THE King Willie wasn’t just any old street corner pub, it was our street corner pub, 100 yards from the ancestral home in Shildon."	['N/A']	EN-GB
1852	"New York state is banning the sale of ""synthetic marijuana'' that's sold in convenience stores, smoke shops, and tobacco stores under brand names including ""Spice'', ""K2'' and ""Mr. Nice Guy."""	['N/A']	EN-US
1145	"Dallas Stars forward Roope Hintz (24) and goalie Ben Bishop (30) celebrate the team's 2-0 victory over the Buffalo Sabres in an NHL hockey game Tuesday, March 12, 2019, in Buffalo, N.Y. (AP Photo/Jeffrey T. Barnes)"	['N/A']	EN-US
1421	"Sleeping in on a day off feels marvelous, especially for those of us who don't get nearly enough rest during the workweek. But are the extra weekend winks worth it? It's a question that psychologist Torbjorn Akerstedt, director of the Stress Research Institute at Stockholm University, and his colleagues tried to answer in a study published Wednesday in the Journal of Sleep Research."	['N/A']	EN-US
1	"The museum dedicated to Darlington's railway heritage is as much about inspiring future generations as celebrating the past, writes passionate supporter, Colin Foster, president of the North Eastern Railway Association"	['N/A']	EN-GB
1419	ADVENTURER and television presenter Ben Fogle has returned to his educational roots to inspire the next generation of explorers.	['N/A']	EN-GB
1488	A SELF-EMPLOYED window cleaner may lose his business after being banned from driving for three years for refusing to provide a breath sample.	['N/A']	EN
2872	"When a gunman opened fire inside a Walmart in Thornton Wednesday night, shoppers screamed and ran for cover — and others pulled out their own handguns."	['N/A']	EN-US
1670	"“Her death was senseless. If I could have videotaped her last moments, traveled back in time and showed her how horrible her death would be, I think she would've quit,” Joe Konrath said of his mother, Laura."	['N/A']	EN-US
2947	"Up to 980 jobs are being axed at retailer New Look under plans to shut 60 stores and slash rent on nearly 400 shops as part of a rescue deal, the company said."	['new look']	EN-GB
372	OUR region can boast of many wonderful things but the quality of its road network is not one of them.	['N/A']	EN-GB
149	MARK Jones believes the arrival of new faces can give Oxford City a spark when they host high-flying Woking tomorrow.	['N/A']	EN-GB
406	Apple has lost a legal fight with a Chinese company that a Beijing court says is allowed to use the iPhone name on wallets and handbags.	['N/A']	EN
1510	"In this Aug. 12, 2017, file photo, a man wears a 'Make America Great Again' hat during the ""Unite the Right"" rally in Charlottesville, Virginia. A Minnesota law that bars voters from wearing political hats, T-shirts, buttons and other apparel to the polls is about to get a look from the Supreme Court."	['N/A']	EN-US
852	THE LIFE of one lucky jet-setting Southampton resident has changed after they scooped a winning lottery ticket and a holiday.	['N/A']	EN-GB
2336	"A WHEATLEY man has taken part in a promo stunt involving a guide dog, a burger, and a trip to Paris."	['N/A']	EN-GB
1312	"An Eagle County District Judge has dismissed a last-chance lawsuit filed by residents of Vail Valley’s luxury Cordillera neighborhood opposed to plans to convert their community’s centerpiece lodge into residential drug treatment facility. After a series of judicial setbacks, the administrative appeal of the county’s approval was the last hope for residents seeking to block a $136 million plan to change the Lodge and Spa at Cordillera into a high-end drug rehabilitation facility."	['N/A']	EN-US
1482	"There was heavy rain forecast for Kempton early in the week, but it should be largely dry in the run up to Boxing Day and the feature card on a wonderful day of racing."	['N/A']	EN-GB
284	"Barry Quinn's first goal of the season brought Oxford United their second straight win, although they made hard work of it against bottom club Droylsden."	['N/A']	EN-GB
614	"FIVE years ago, a man who claimed over £22,000 in Disability Living Allowance appeared in court when pictures of him emerged playing cricket."	['N/A']	EN-US
1480	SEATTLE — Memo to the many places vying for Amazon’s second headquarters: It ain’t all food trucks and free bananas.	['N/A']	EN-US
114	DANIEL AYALA scored for the third game in a row to lift Middlesbrough back into the play-off places after beating promotion rivals Bristol City at the Riverside Stadium.	['N/A']	EN-GB
128	THIS is not only a York Theatre Royal Youth Theatre show but a first intergenerational collaboration with a not-so-youthful group of York community actors.	['N/A']	EN-GB
1214	"SIR – I refer to the editorial, We need action over traffic woe (May 15). The News had a go at traffic in its editorial on April 26, and said similar things. “Traffic” isn’t our problem."	['N/A']	EN-GB
1790	"For those who give a rat’s rear, we’re in the throes of an education crisis, a national epidemic that imperils our long- and short-range ability to stimulate and advance our intelligent young."	['N/A']	EN-US
2626	"Guided by his church's teachings, Bishop Thomas Doran of the Roman Catholic Diocese of Rockford believes state legislators — by legalizing civil unions for gay couples without protecting religious organizations — forced Catholic Charities to terminate its tradition of caring for foster children in 11 northern Illinois counties."	['N/A']	EN
1006	"We find ourselves in Downtown Seattle daily. Meeting with condo owners, showing available inventory or just enjoying the city like everyone else. What is fascinating is how quickly our city is growing. We have all heard the headlines about the Expedia move, the potential US headquarters for Alibaba, Facebook expansion and the rapid Amazon growth. So with that said, what does that all mean – in terms of growth. He is a breakdown with help from the DSA 2014 Development Guide:"	['N/A']	EN-US
304	"TOGETHER with my 16-year old grandson, who I may add is somewhat of a connoisseur in the burger domain, we set off for our Wednesday lunch date at The Moose Kitchen, rustically furnished with wooden pine tables and comfy chairs, very much in keeping with the Canadian cuisine."	['N/A']	EN
2243	"CORVALLIS, Ore. - A new publication on some of the best vegetable varieties for western Oregon gardens has been released by Oregon State University Extension Service."	['N/A']	EN-US
1356	"By now, you’ve probably heard that “sitting is the new smoking.” And you probably know a smug cubicle dweller who won’t shut up about how great he feels after switching to a standing desk."	['N/A']	EN-US
2922	THE pride of a quiet residential street for Paralympic champion Lily van den Broecke yesterday shone brighter than its gold postbox.	['postbox']	EN-GB
1037	"ABOUT this time last year, Yorkshire's squad were preparing for their pre-season tour of Dubai."	['N/A']	EN-GB
2984	A WOMAN whose dog clamped its jaws around a shih tzu’s scrotum after being attacked in its owners arms is set to be sentenced.	['N/A']	EN-GB
1865	A BUS has been transformed into an inspirational learning environment to encourage students with special educational needs to read for fun and improve literacy skills.	['N/A']	EN-US
2231	A UNIQUE Victorian steam locomotive is to take an important step forward towards possible restoration to full working order thanks to a generous donor.	['N/A']	EN-GB
782	Some 140 area jobs will disappear shortly as the maker of Vanish and other household products has told U.S. Can Corp. that a competitor has beaten the Oak Brook firm out of a global contract to supply aerosol cans.	['N/A']	EN-US
2316	"The City of Buffalo is facing financial ruin, and possible receivership, because of me. I'm one of those Buffalo firemen who took a personal leave on Christmas Eve to spend the evening with my family."	['N/A']	EN-US
1583	A SCHOOL undergoing a period of transformation has been told it must make further improvements.	['N/A']	EN-GB
1439	"A FIREPLACE from the Poole home of Lord of the Rings author JRR Tolkien has attracted a £50,000 bid days after being listed on eBay."	['N/A']	EN-GB
2558	WEB-TECH firm Olamalu is helping boost youngsters’ maths skills across seven primary schools.	['N/A']	EN-US
2857	"When Penny Andrews left South Africa for the United States in 1983, she had the names of people who could help if she ran into trouble."	['N/A']	EN-US
2263	"Ten months after she opened her first cake shop in Newport, baker Beth Sims spoke to NICHOLAS THOMAS about her firm’s extraordinary early successes"	['N/A']	EN-GB
1136	A RENOWNED angler who fishes all over the world and is a freelance writer for fishing and hunting magazines has made an appearance in the country pursuits arena at the Great Yorkshire Show.	['great yorkshire show']	EN-GB
1795	"NINE young Dragons feature in a 32-man Wales squad for this year’s U20 Six Nations, which gets under way on the first weekend in February."	['N/A']	EN-GB
1194	"Final returns on Tuesday for Erie’s municipal election, billed in recent months as a referendum on the town’s renewed post-Firestone approach to oil and gas regulation, confirmed a wide-margin victory for mayoral candidate Jennifer Carroll."	['N/A']	EN-US
2077	NEWPORT County AFC have completed a 12th January signing with Ryan Bird becoming the sixth forward to arrive at Rodney Parade this month.	['N/A']	EN-GB
1982	A former member of Denver Mayor Michael Hancock’s security detail who has accused him of sexual harassment is saying that she wants an investigation into the matter to go forward.	['N/A']	EN-US
1238	"Cyber Security has not always been a high priority among businesses. However, with the growing threat and proven damage showing among high profile companies and services like TalkTalk, Equifax, Yahoo and even the NHS has shone light on how cyber security should be taken very seriously."	['N/A']	EN-GB
1591	"On Tuesday, students gathered in the Norris Lake room, where a multitude of seats were surrounded with a circular array of eight PA speakers. Each seat contained a black eye mask, similar to what one would wear while they sleep. The audience was instructed to put on the masks as the lights were turned off and the show began."	['N/A']	EN-US
814	"A Howard County judge denied yesterday a request by The Sun and another news organization to make public the plea agreement of Francisco Rodriguez, a participant in the murder of state police Cpl. Theodore D. Wolf."	['N/A']	EN-US
374	"A LOT can happen in the space of ten months, the length of time Sunderland have been waiting for a home victory. If you had fallen pregnant on the day of the Black Cats’ last Stadium of Light success, your baby would now be four weeks old."	"['sunderland', 'sunderland']"	EN-GB
1958	"When restaurateur Ed Schoenfeld recites his address to dinner guests, he gets blank stares."	['N/A']	EN-US
644	"In its first-ever audit to test whether black and Latino renters face barriers in the housing market, Portland found that landlords and leasing agents discriminated in 64 percent of 50 tests across the city."	['N/A']	EN-US
1021	Plano and McKinney voters will decide Tuesday if their city charters can be amended to allow for longer city council terms.	['N/A']	EN
1290	The NFL suspended Seahawks linebacker Leroy Hill one game on Friday for violating the league’s substance abuse policy. He will miss the season opener against San Francisco.	['N/A']	EN-US
110	"Florence Rogers, a civic activist who successfully campaigned to create the Soldiers Delight Natural Environmental Area near Reisterstown, died Wednesday of heart failure at her Pikesville home on Seven Mile Lane. She was 93."	['N/A']	EN-US
808	"Howard County's appeals board Thursday rejected a proposal for a 2,000-square-foot Hindu temple in Woodbine, providing relief to a vocal group of area residents who argued the temple would disturb the rural calm of Millers Mill Road."	['N/A']	EN-US
2300	A MUCH-loved musical is set to be performed at Theatre Royal Winchester during February half term.	['N/A']	EN-GB
1721	Take That have announced a major tour for the new year and will be calling at Southampton.	['N/A']	EN
2588	You’ve decided to give up diet soda — good idea! Maybe you weren’t hitting your weight-loss goals or couldn’t stomach that long list of ingredients anymore. Or perhaps you heard one too many times that it’s just not good for you.	['N/A']	EN-US
1165	"Kathleen D. Jameson, an administrator at the private Albuquerque Academy and a former public school teacher, has been chosen as the sixth head of Oldfields School in Glencoe."	['N/A']	EN-US
1059	"YOUNG James Lowe was in such torment after months of self-harm that he hanged himself in the family garden, an inquest heard."	['N/A']	EN
1110	LONGMONT — — The big brick building that once served as a prisoner-of-war facility during World War II now helps the homeless by offering inexpensive housing and ongoing workshops in finance skills.	['N/A']	EN-US
2589	"In the early 1900’s, as modern journalism was taking form, there was a significant debate between Walter Lippman and John Dewey as to the appropriate role of journalism in regard to government. Mr. Lippman advocated that journalism’s role was to act as translator between the decisions of the elites of government and the populace. Mr. Lippman believed that the general public was incapable of understanding the intricacies of public policy or the rationale for political decisions and required the press to translate and reduce the discourse to a layman’s level of intelligence. In doing so Mr. Lippman placed himself amongst the elitists and a confidant of the politicians."	['N/A']	EN-US
1143	A woman who said she was sexually assaulted by another passenger onboard an overnight American Airlines flight last year has sued the carrier in federal court.	['N/A']	EN-US
53	"CARA Gainer is still pinching herself following a debut season to remember, writes JAMES ROBERTS."	['N/A']	EN
855	NEW plans to support Welsh farmers once the UK leaves the European Union have been revealed.	['N/A']	EN-GB
1806	"Roberta Szyper of Carnegie, Pa., wrote to the Philadelphia Daily News about her experience at Super Bowl XLV."	['N/A']	EN-US
1843	"They tried to trade for him at the winter meetings last year, and when that didn't work out, the Baltimore Orioles kept on guard for the moment that Jim Poole would become available."	['N/A']	EN-US
722	"Jeff Manto has two years of experience as a major league hitting coach with Pittsburgh in 2006 and 2007. That's the only major league experience that any of the three new coaches -- third base coach Joe McEwing, bench coach Mark Parent and Manto -- have as they join the staff of White Sox first-year manager Robin Ventura."	['N/A']	EN-US
943	A NATIONAL celebration of teachers has recognised the work of Selby College tutors for giving their students the best possible start in their career.	['N/A']	EN-US
1578	"CHRIS COLEMAN has promised he will “not be pulling any punches” with his underperforming Sunderland squad, and has issued a direct challenge to Jack Rodwell to prove how much he wants to play for the Black Cats."	['N/A']	EN-GB
2730	Tracy van der Heiden of St Edward’s School on a tiny art auction that promises to punch above its weight	['N/A']	EN-US
1499	"THIS Bank Holiday Monday will see 24 people leap into the sky at 13,000 feet to raise money for quadruple amputee Charlotte Nott."	['N/A']	EN-GB
1294	TEENAGER Huw Cammack lost over six stone after piling on the pounds when he was injured. He tells health reporter Kate Liptrot about his transformation.	['N/A']	EN-GB
1453	"On the same day he introduced legislation to tighten Cook County's ethics laws, County Board President Richard Phelan was accused of unethical behavior by one of the board's members."	['N/A']	EN-US
1152	Nobody was surprised when Ezekiel Elliott soared in his rookie season. He came into the NFL with supreme talent and joined a prolific offense with one of the most dominant offensive lines in the game. That’s the kind of “perfect storm” of opportunity you dream about in a first-year fantasy player.	['N/A']	EN-US
1137	STUDENTS were aiming for the stars during a special contest to encourage the next generation of engineers and scientists.	['N/A']	EN
1644	Nothing beats the downtown Dallas skyline at dusk. The bright green glow of Bank of America Plaza. The flashing lights of Reunion Tower. The orange fade of the western sky reflecting on every window. This sight has always inspired faith in me.	['N/A']	EN-US
1251	"Writing that high school students do not have a constitutional protection against sharing locker rooms or bathrooms with transgender peers, a federal judge has sided against a group of parents who sued a Palatine school district seeking to deny locker room access to a transgender student."	['N/A']	EN-US
2548	Viv Hardwick goes under the green skin of Shrek the Musical to discover how an animated Hollywood movies was always destined to play UK venues like Drury Lane and Newcastle	['newcastle']	EN-GB
1205	BOURNEMOUTH will be the home of an academy for people who want to learn about web development while launching their own businesses.	['N/A']	EN-GB
1762	"A French con artist, who in a new book documents his scheme to squeeze $1.2 million out of America’s upper crust by posing as a Rockefeller, was ordered to fork over the bulk of his literary proceeds while serving nearly four years in prison."	['N/A']	EN-US
2356	AN unlikely but uplifting pub story has been unfolding in York for the past couple of years.	['N/A']	EN-GB
2307	"A NEW year brings a new Malcolm Ludvigsen exhibition, this one at York's newest art space, the Village Gallery on Colliergate, from next Tuesday."	['N/A']	EN-GB
983	STEWART DOWNING is ready to buy into the Tony Pulis way but has warned his Middlesbrough team-mates they will be shipped out during this month’s transfer window if they don’t follow his lead.	['N/A']	EN-US
2855	"MIAMI — After consecutive disappointing seasons and with his club stumbling through its third-worst start in franchise history, manager Jim Tracy finds himself the No. 1 target for Rockies fans wanting a scapegoat."	"['""miami"", ""rockies fans""']"	EN-US
356	The New York Times said it will offer buyouts to newsroom and business staffers in its latest effort to cut costs.	['N/A']	EN-US
537	"The IS agency for women, has launched a ‘cookbook’, explaining how to keep jihadists happy and fulfilled by making pancakes after a day of fighting."	['N/A']	EN-US
565	YORK City Knights second-row star Joe Batchelor has signed a three-year deal with Super League leaders St Helens - although he won't leave Bootham Crescent until the end of the current season.	['N/A']	EN-GB
1816	A sweeping package of bills being considered by the General Assembly would change how child support payments are determined by Maryland courts.	['N/A']	EN-US
2767	CHRIS COLEMAN admits his January wheeling-and-dealing will be crucial to Sunderland’s prospects of pulling clear of trouble in the second half of the season.	['N/A']	EN-US
1365	"WASHINGTON -- As President Clinton pursues a legacy he hopes will place him in the pantheon of Democratic greats, there is -- even putting aside allegations of personal misconduct -- a nagging problem: Despite the booming economy and his sky-high job approval ratings, Clinton's record includes the dubious distinction of presiding over his party's 1994 loss of both houses of Congress."	['N/A']	EN-US
1932	"Lackawanna City Hall goes on its summer schedule beginning Sunday, meaning it closes at noon on Wednesdays during July and August."	['N/A']	EN-US
442	"When Republican Senate candidate Mark Kirk says he repeatedly deployed to Afghanistan with the Navy, he's referring to two-week training missions as part of his annual reservist requirements."	['N/A']	EN-US
1650	"One of the best and most neglected films of 1995 was ""The Last Good Time,"" director Bob Balaban's offbeat love story about the on again-off again relationship between a grumpy, lonely old man and a sad, desperate young girl."	['N/A']	EN-US
1994	"A homeowner shouldn’t need a law degree to pick an electricity plan. After all, choice and competition work if average consumers don’t have to hack through confusing language to find the best deal."	['law degree']	EN-US
1615	Sometimes in sport you just have to hold your hands up and admit you got beaten by a better team.	['N/A']	EN-GB
2237	WILL Eason has praised the impact of overseas player Darryl Brown ahead of Horspath’s derby clash at home to Banbury.	['N/A']	EN-GB
2238	"A PHOTOCOPY may be all she has left of this priceless work now, but the memory of being sketched by Pablo Picasso will never leave artist Dorothy Boyesen."	['N/A']	EN
2852	I AM a retired staff nurse and have been gladdened to hear that campaign groups have managed to refer the planned changes for NHS in Dorset back to the government. I believe the groups should be roundly congratulated for their very hard work.	['N/A']	EN-GB
607	Obama's choices as legal counsel are said to have a more narrow view of executive power than Bushs' lawyers did.	['N/A']	EN-US
2262	YORK City boss Colin Walker is considering a move for former England Under-21 striker Bruce Dyer.	['N/A']	EN-GB
2108	THE voice of comedy Rob Brydon brings his stand-up show to Sunderland Empire in early December... for one night only.	['N/A']	EN-GB
865	"BRUSSELS –– A man who attacked two police officers in the Belgian city of Charleroi Saturday was identified as a 33-year-old Algerian national, prosecutors said Sunday. Islamic State claimed responsibility for the attack."	['N/A']	EN-US
532	The worlds of Casualty and Holby City will collide as the hospital comes under cyber attack in a special crossover episode.	['N/A']	EN-GB
2673	"About 120 teachers picketed outside a Palatine-based high school district Thursday after a negotiating session with a federal mediator failed to generate a resolution and union leadership set a strike date for next Thursday. The union's six-member bargaining team will resume talks with the district and a mediator at 8 a.m. Monday, a day when no classes are scheduled for Township High School District 211, the state's largest high school district."	['N/A']	EN-US
1724	A TROUBLED mental health trust has pleaded guilty to breaching health and safety laws following the death of a patient in its care.	['N/A']	EN-US
2557	"Tom Cruise is in San Diego for the anticipated ""Top Gun"" sequel. NBC 7's Joe Little is at Naval Base Coronado with more. (Published Monday, Oct. 8, 2018)"	['san diego']	EN-US
2889	A COMPANY which began life in Weymouth has secured £2.5million worth of funding to support its store expansion programme and growth plans.	['N/A']	EN-GB
371	"WASHINGTON -- This town spawns erratic career jumps, as any actor-turned-congressman or tycoon-become-ambassador could tell you, but Wendy Sherman's resume is diverse even by D.C. standards."	['N/A']	EN-US
2754	SKIPPER Josh Grajczonek reckons there is plenty more to come from Pirates as they prepare to renew rivalries with Belle Vue.	['N/A']	EN-US
568	THE body representing family doctors in Wales has given a cautious welcome to Welsh Government proposals to invest up to £68 million in 19 health and care centre projects during the next four years.	['N/A']	EN-US
