Id	Instance	Markers	New.Gold.Label
116	WESTMINSTER -- An extensive collection of miniature American Indian collectibles owned by Gail and Oden Kemp of Hampstead is the focus of a new exhibit now on display at the Carroll County Farm Museum.	['N/A']	EN-GB
472	Updated at 2:50 p.m.: Revised to include McAllen Rep. Vicente Gonzalez's endorsement of Julián Castro for president.	['N/A']	EN-US
3	IT will be a homecoming of sorts for James Blunt when he makes his return to Bournemouth next week.	['N/A']	EN-GB
2645	TOMMY Hayes and Richard Higgs claimed the inaugural Baylis Pairs Cup final at Worcester’s Ravenmeadow and Perdiswell Park.	"[""worcester's ravenmeadow and perdiswell park.""]"	EN-GB
3000	CRAIG HIGNETT has paid tribute to match-winners Josh Hawkes and Luke Molyneux after showing the composure to help Hartlepool United complete a remarkable comeback.	['hartlepool united']	EN-GB
188	"Writer-director Michael Tully's ""Ping Pong Summer,"" inspired by summer vacations in the Ocean City of the 1980s with his parents, will have its world premiere at January's Sundance Film festival."	['N/A']	EN-US
1999	"There is reason to step back into the sadness and hurt of 12 years ago, to bring back the gut feeling so many of us shared that September morning. As bad as what was taking place in New York City became, we looked up at an American flag and saw something good. That good is the reason we must remember."	['N/A']	EN-US
2522	The feature “On this day in Stanford history” details events that occurred on the same date in past years at Stanford.	"['stanford', 'stanford']"	EN-US
1964	NICK Schonert is back fit and ready to face his “ultimate test” at scrum time when he locks horns with loosehead prop Ben Moon at Exeter Chiefs today (2pm).	['N/A']	EN-US
726	NEWPORT County AFC manager Michael Flynn saw his side end their long wait for a home win on Saturday but more missed chances convinced him that he needs to add to his attacking options.	['N/A']	EN-GB
1758	Caitlyn Jenner received overwhelming public support this week when she appeared in Vanity Fair showing her transition from Olympic icon Bruce Jenner.	['N/A']	EN-US
2928	"Four men posing as telephone repairmen -- including James O'Keefe, a filmmaker whose undercover videos have scandalized the ACORN community organizing group -- have been arrested for allegedly interfering with the telephones in Democratic Sen. Mary Landrieu's office in downtown New Orleans."	['posing']	EN-US
2707	Sirens wailed while workers piled sandbags in front of hotels and police blared warnings to tourists to leave the world-famous Waikiki Beach as Hurricane Lane barreled north after dumping nearly 2 feet of rain on Hawaii's mostly rural Big Island.	['good']	EN-US
2636	"Denver probably won’t see the worst of a massive, slow-moving winter storm headed to the state today, but it’s highly unlikely the metro region will escape it."	"['slow-moving winter storm headed to the state today,', 'denver']"	EN-US
1430	"MONMOUTH Town have confirmed the signing of former Newport County AFC, Cheltenham Town and Swansea City striker Julian Alsop until the end of the season."	['N/A']	EN-GB
1060	"Gates, the only Cabinet member held over from the Bush administration, also told moderator David Gregory that President Obama “is somewhat more analytical” than his predecessor."	['N/A']	EN-US
55	A TRUCK driver involved in a horror crash has thanked the Great North Air Ambulance Service for saving his life.	['N/A']	EN-GB
2043	"AFTER the battering of the Bay of Biscay, Sam Davies has been enjoying some relaxation time as the weather improves on the Vendée Globe race."	['N/A']	EN
631	When 100 local artists get their hands on some old-fashioned folding models and turn them into objets d'art.	['N/A']	EN-US
1933	"IT was something straight out of a James Bond movie, as one air festival spectator enthused."	['N/A']	EN-GB
1151	"Female sprinters are closing the gap on their male counterparts and may post faster times by the 2156 Olympic Games, researchers at Oxford University said."	['N/A']	EN
928	"Miriam Sontz started as a volunteer at a feminist book store in Portland, jumped around different companies, and finally settled at Powell’s Books."	['N/A']	EN-US
827	GEORGIA O’CONNOR impressed as British Boxing’s elite team of amateurs competed in their first international tournament of 2019 in Hungary.	['N/A']	EN-US
501	Teams are changing the way your children's classes are taught and the way airplanes are built.	['N/A']	EN-US
1700	ZANE Kirchner is desperate to provide value on the pitch in the Dragons’ Guinness PRO14 run-in as the former Springboks full-back prepares to make his return to action.	['N/A']	EN-GB
1094	AIDAN Hawtin and Sam Humphreys have been released from their Oxford United contracts early to play in Norway.	['N/A']	EN-GB
1715	Southampton-based luxury cruise company Cunard have revealed plans for investment in their Queen Victoria ship. – and introduce tea and coffee making facilities in all their fleet’s cabins.	['N/A']	EN
804	OXFORDSHIRE booked their place in the final of the ECB Royal London Under 17 Cup with a thrilling one-run victory off the last ball of their semi-final with Leicestershire at Oxford Downs.	['N/A']	EN-GB
1662	FORMER Darlington goalkeeper Adam Bartlett is relishing the potential hostility that will be generated by York City’s visit to his old club this weekend.	['N/A']	EN-GB
2607	":47 Dozens injured from turbulence on nightmare flight On a flight over Sumatra, Indonesia, passengers on Etihad Airways endured a violently turbulent ride. The turbulence was so severe that it caused visible damage to the interior of the plane."	['etihad airways']	EN-US
2027	"WAY back in 1974, a mammoth task was undertaken when one of the hidden gems of Worcester High Street, Steward's Chemist Shop, which stood opposite the Guildhall, was relocated lock, stock and many a bottle, half a mile across the city to the Art Gallery & Museum in Foregate Street."	['N/A']	EN-GB
2643	"As I return to the nation's capital from home back in Austin, Texas so we can finish our work out before the end of the year, I wanted to relay some of the wisdom that I heard from working families and Texans back home about their verdict on what we have done so far this year and actually even last year."	['texas']	EN-US
31	"Amazon is planning a cheaper music subscription service that would cost around $5 a month and would only work on its Echo hardware, according to a report."	['N/A']	EN-US
2654	WIGGINTON Grasshoppers went top of the Fastpack Ltd York Sunday Morning Football League first division after Harry Clapham scored a hat-trick in a 4-1 win at Brayton.	['N/A']	EN-GB
1388	"THE sixth Aesthetica Short Film Festival will be the biggest yet, promising 400 films in 18 venues over the four-day event running from November 3 to 6 with the invitation to ""Explore York, Experience Film""."	['N/A']	EN
1230	Monmouth MP David Davies met with apprentices from David Wilson Homes in the town to celebrate New Homes Week.	['N/A']	EN-GB
2598	"There's no need to wait until 2016 (we hope!) for fantastic sports in the Chicago area. The schedule is full this season. All tickets available through Ticketmaster (312-559-1212, ticketmaster.com) unless otherwise noted. All season end dates are for the last home game."	['the chicago area']	EN-US
1523	"SITUATED just off of London Road, The Alex has the appearance of a traditional English pub, but the interior of a film buffs dreams."	['N/A']	EN
1436	"A CLASSICAL Gothic thriller is coming to Malvern Theatres, but who will be the star, Dr Jekyll or Mr Hyde?"	['N/A']	EN
415	"US employers took an early spring break in March, ending a healthy hiring streak by adding just 126,000 jobs — the fewest since December 2013."	['N/A']	EN
195	"Exelon is back at the Capitol trying to win financial help for two struggling nuclear power plants, pushing what opponents have called a ""Christmas tree"" of giveaways that they estimate could cost consumers as much as $24 billion over 23 years."	['$24 billion']	EN-US
2762	"Russell Morgan wants the corporate honchos at Starbucks to know that when it comes to closing store locations, they don't know beans."	['N/A']	EN-US
505	"Watch how they make this amazing rainbow latte out of superfoods. (Published Wednesday, Sept. 20, 2017)"	['N/A']	EN
1627	"Northwestern dropped another heartbreaker Saturday afternoon, this time to Purdue, to fall to 2-6 in Big Ten play. After a back-and-forth game for all 40 minutes, Shurna’s desperation three-point attempt was way off as time expired and Purdue escaped with a 58-56 win."	['N/A']	EN-US
1621	AN OXFORD city centre street has been closed after a hole appeared in the middle of the road.	['N/A']	EN-US
2823	"When I’m reading speculative fiction (e.g. science fiction and fantasy), I feel like I have the freedom to be my natural self. It’s not mere escapism, as critics often say; it’s using a story and its enumerated elements for self-realization. I’ll always remember the first time I picked up “Harry Potter” and my first Ted Chiang novella “Story of Your Life,” and how they’ve shaped who I’ve become."	['self-realization']	EN-US
2322	"Before the conversation, McCarthy and Ryan had emerged from separate talks at the U.S. Capitol with Ukrainian Prime Minister Volodymyr Groysman, who had described a Kremlin tactic of financing populist politicians to undercut Eastern European democratic institutions."	['N/A']	EN
777	DIDCOT duo Dan Rivers and Ben Watson were flying the flag at their old school yesterday as they reflected on their Commonwealth Games triumphs.	['N/A']	EN-GB
1486	"St Joseph Village of Chicago, a Franciscan Community, is hosting ""Dining, Desserts & Dementia"" on Thursday, October 11, from 6 pm-7:30 pm, for caregivers and families whose loved ones suffer from dementia and are having difficulty eating."	['N/A']	EN-US
1737	"With a new series of Life Stories about to air, Piers Morgan talks to Sherna Noah about pay, early alarm calls, his pin-up Pamela Anderson and Good Morning Britain co-host Susanna Reid"	['N/A']	EN-US
845	"Howard Cosell, who died yesterday at 77, was at his core a shameless self-promoter, full of bombast, self-importance and self-righteousness, the kinds of qualities that routinely made him America's least-liked sportscaster in a series of TV Guide polls."	['N/A']	EN-US
672	THERE weren't many purple UKIP rosettes on show but the party has arrived as a political force on Winchester City Council.	['N/A']	EN-GB
2777	"With hundreds of people expected to use the Newport Night Shelter during the cold winter months, Chris Seal speaks to the people that use it to see how it has helped them over the Christmas period."	['newport night shelter']	EN-GB
2774	"""I got really suicidal. I should have been sitting in a high school classroom. Instead, I was being sold repeatedly to men. Crowded parking lots full of men waiting for me. I felt lower than dirt. I hated myself. I couldn't even imagine ever talking to my family again. How could they ever understand what I was going through?"""	['N/A']	EN-US
2035	WARRIORS boss Alan Solomons says Welsh international Josh Adams is still wanted at Sixways – despite public overtures from west of the border.	['N/A']	EN-GB
2625	POLICE have identified more than a dozen youngsters who were responsible for a spate of vandalism and attacks on buses earlier this year.	['N/A']	EN-GB
785	A NEW report published today by a campaigning charity highlights the devastating link between poverty and suicide.	['N/A']	EN-US
2886	"Union membership in Wisconsin has declined nearly 40 percent since legislation was passed that gutted collective bargaining for public workers, according to federal data."	['wisconsin']	EN-US
688	A LABOURER who sent a series of threatening texts to his ex-girlfriend has been handed a suspended prison sentence.	['N/A']	EN-US
2726	MATT Paterson’s second-half strike gave Oxford City victory over neighbours Oxford United to reach the Oxfordshire Senior Cup final.	['oxford city']	EN-GB
1363	A DOCTOR accused of sexually assaulting a woman at the John Radcliffe Hospital claimed the examination of her was purely medical.	['N/A']	EN-GB
1953	PIRATES chief Matt Ford hailed the exploits of star man Nicolai Klindt following their first away win of the season in the SGB Premiership.	['N/A']	EN-GB
1409	"Orioles manager Brandon Hyde had a split reaction Friday to the rule changes jointly announced by Major League Baseball and the MLB Players Association a day earlier. The more immediate measures to address pace-of-play issues were welcome for the first-year skipper, but his thoughts on the 2020 changes that will address strategy were more measured."	['N/A']	EN-US
1842	"Mary L. Good, president and director of research of Signal Research Center Inc., Des Plaines, has been elected 1987 president of the 135,000-member American Chemical Society. The society is the world`s largest organization devoted to a single science."	['N/A']	EN-US
2828	"NEW DELHI, India - The American head of an Indian Internet firm caught up in a video scandal involving teen sex was released on bail yesterday as police interrogated the private school student who filmed the lewd clip with a cell phone camera."	['N/A']	EN-US
736	"As word spread about the nightmare accident that killed three New Jersey women, their grieving friends said they were certain alcohol wasn’t involved."	['N/A']	EN-US
1431	A DECISION to shelve a controversial vote to repeal fox hunting restrictions has received cross-party support in the North-East.	['N/A']	EN
2653	"The Orchard Park Council of the Arts will continue its summer program at the pavilion with a performance by the Nickel City Clippers and Bill Steven's Dixielanders during ""New Orleans Night"" Sunday."	['new orleans']	EN-US
388	THE 12 shortlisted artists for the Aesthetica Art Prize will showcase the new generation of talent at York Art Gallery from May 18 to September 30.	['N/A']	EN-GB
794	PHIL NEVILLE reckons he could not be more qualified for the job of England women’s head coach. What nonsense.	['N/A']	EN-US
1511	FORMER labourer and Sunday League striker Reece Thompson has admitted he is still in a state of shock after landing a professional deal with York City.	['N/A']	EN-GB
1643	"A University of Colorado professor who’s been criticized for his writings about climate change has been caught up in WikiLeaks’ dump of emails involving John Podesta, campaign chairman for Hillary Clinton."	['N/A']	EN-US
118	"A DAY of festivities, including a spectacular bicycle ballet, a lifelike animatronic dinosaur and an international-class racing powerboat will mark the ending of stage one of the inaugural Tour de Yorkshire in Scarborough."	['N/A']	EN-GB
2642	"In the new world financial order, the Europeans are in currency chaos. But all is much quieter on the front where the U.S. securities and futures industries used to snipe at each other."	['N/A']	EN-US
2587	Headington B finished with a flourish to triumph on Summertown Trophy finals day at Banbury Chestnuts.	['N/A']	EN-GB
2917	"WHEN we think of Southampton’s Oxford Street we might picture the swanky bars and restaurants at night, or enjoying relaxed lunches in the sun."	['N/A']	EN-GB
2403	"WORCESTERSHIRE had a post-tax surplus of £449,426 for the financial year ending December 31, 2017."	['N/A']	EN-GB
1501	"Chicago`s first Thai Room on North Western Avenue earned a good reputation for its authentic cooking. It has branched out to a fancy address on Huron, and now downtowners can sample the spicy thrills of Thai cuisine."	['N/A']	EN-US
2468	"The national transit union is spending hundreds of thousands of dollars on social media ads attacking Mayor de Blasio as a “fauxgressive” as he travels to early presidential primary voting states — including South Carolina, where he’s visiting Saturday."	['N/A']	EN-US
630	CROMWELL Youth AFC U12s are celebrating after winning the Newport and District Cup final 2-1 at the Newport Stadium in a close match with Villa Dino.	['N/A']	EN-GB
2532	"Contemporary artists have a lot on their plate. Not only has the current economic meltdown made their lives more precarious than ever, they have also been faced with an increasingly apocalyptic world as a looming, correlative subject. If there were any lingering doubts that today’s performance artists and choreographers were addressing such matters, these would have been quickly dispelled at this year’s Northwest New Works Festival at On the Boards, held during the weekends of June 4-6 and June 11-13. The majority of these local artists, most of them familiar to audiences in Seattle, have stepped up to the unprecedented challenges we face, though some with far more success than others."	['seattle']	EN-US
801	BOSS Brendon King believes Hamworthy United have given themselves a “massive platform” to achieve a club-high finish in Sydenhams Wessex Premier.	['N/A']	EN-GB
2897	"EUGENE -- Entering the season, Washington's receiver corps was an unproven bunch but Aaron Fuller quickly changed that and has emerged as one of the best wide outs in the Pac-12."	['N/A']	EN-US
2471	"The Rangers traded the past and the future for the present Wednesday morning, obtaining 38-year-old reigning Art Ross winner Martin St. Louis from the Lightning in exchange for captain Ryan Callahan, a first-round draft pick in 2015 and a second-rounder in 2014."	['N/A']	EN-US
454	"Trying to stave off the moment when I would have to do some actual work, I riffled through a stack of business magazines. It was sort of work — there were ads for office equipment, desks, ergonomic chairs and sleek little machines that through the miracle of technology take work you should be doing and dump it on someone else. Who says modern electronic wizardry is overrated? With the simple click of a mouse, my problem becomes your problem."	['N/A']	EN
396	THE BISHOP of Durham gave a keynote address in front of the Queen at the celebration of the 150th anniversary of a unique Christian charity.	['N/A']	EN-GB
2047	Two brothers of a man murdered during a Mafia-engineered home invasion robbery angrily confronted a Bonanno wiseguy outside a courthouse today and FBI agents intervened to prevent them from assaulting the mobster.	['N/A']	EN-US
2957	A MAN jailed for 11 years for his part in a series of aggravated burglaries in the Southampton area has escaped prison.	['N/A']	EN-GB
134	"Over the last five years, New York has paid more than $5 million to settle lawsuits against 70 state employees accused of sexual harassment or gender discrimination. The I-Team's Chris Glorioso reports. (Published Wednesday, Nov. 28, 2018)"	['N/A']	EN-US
1793	"The National Football League Players Association website has a page dedicated to where each team’s salary cap stands. It’s updated daily and presents a sobering truth to Ravens fans who are dreaming up a free-agent haul that includes center Ryan Jensen, wide receiver Allen Robinson and tight end Jimmy Graham."	['N/A']	EN-US
1942	BOSSES behind the ABP Southampton Marathon have made a plastic pledge for this year’s event.	['N/A']	EN-US
2210	THE ASHFORD Town Board in Cattaraugus County has apparently made it more possible for New York State to pick West Valley as the location of the low-level radioactive waste storage area it must establish by 1993.	['N/A']	EN-US
1943	MEMORIES 382 back in July told of the 30th anniversary of the day a Second World War Spitfire was flown beneath Winston bridge over the River Tees.	['N/A']	EN-US
659	A MAN is back behind bars after abusing officers and staff at a hospital – just two days after being released from prison.	['N/A']	EN-GB
2477	"Peace talks in Colombia began earlier this month with the usual flourish: a show of force by freelance paramilitaries, directed at the Marxist guerrillas, that left about 130 dead, most of them civilians. It seems one side or another always tries to make a statement in blood just before sitting down to talk peace."	['N/A']	EN
602	"The Hills of Scottsdale, Ariz., face the great dilemma: choosing to make a move to better their careers or better their family life."	['N/A']	EN-US
2578	"PHOENIX — A man who shot and killed a call-center CEO and critically wounded a lawyer at a Phoenix office building where they were meeting to discuss a contract dispute was found dead early Thursday, ending a nearly 24-hour manhunt that had area residents on edge."	['N/A']	EN-GB
1197	VIRGIL van Dijk insists he will not be bothered if he is booed by Saints fans when he returns to St Mary’s on Sunday with Liverpool.	['N/A']	EN-GB
569	"A 54-year-old pedestrian has died after he was struck by a car which had previously been followed by officers, police said."	['N/A']	EN
2423	NEIL Middleditch was left to rue a dramatic twist in the tail as Pirates saw SGB Premiership points go begging at Rye House.	['N/A']	EN
1344	"The Orioles yesterday announced a sweeping 19 percent ticket price increase for next season that will push an average ticket above $15, more than twice what the team charged before moving to Camden Yards four years ago."	['N/A']	EN
2388	Your bathroom mirror will soon show more than your reflection as you get ready for the day.	['N/A']	EN
2387	"News last week that someone hackedMark Zuckerberg’s Facebook page elicited, no doubt, schadenfreude-driven chuckles amid constant concerns about privacy on the half-billion-member social networking site."	['N/A']	EN
2782	SOME residents in Kidlington will be particularly relieved that Campsfield House detention centre is to close.	"['centre', 'kidlington']"	EN-GB
1296	"Ronald A. Alghini, recently named chairman of the Chicago money management firm Mathers & Co., has prepared a letter to shareholders of Land of Lincoln Savings & Loan Association seeking a seat on the association`s board."	['N/A']	EN-US
517	"WHEN you tell someone you foster it takes about five minutes for The Question to be asked, says Andrea."	['N/A']	EN-US
2005	A MAN who drove his car at people outside a bar in Chepstow has been cleared of four counts of attempting to commit grievous bodily harm with intent.	['N/A']	EN-GB
1271	"OXFORD City broke the vet 65 course record when winning gold at the British Masters Cross Country Relay Championships in Long Eaton, near Nottingham."	['N/A']	EN-GB
1874	Denver police have released a photograph of two masked people who robbed and fatally shot a man at a west Denver Regional Transportation District light rail station early Tuesday.	['denver']	EN-US
1503	ELEVEN men who were under investigation following allegations of abuse at a former detention centre are to face no further action.	['N/A']	EN-GB
1387	PRINCESS Anne and her husband Vice Admiral Sir Tim Laurence have joined Portland Bill’s National Coast-watch team.	['N/A']	EN
2091	"Leeds' tour to Myanmar next month has been questioned by Amnesty International due to the country's ""brutal"" human rights record."	['N/A']	EN
2981	MIDWIVES delivering babies across the North-East are among the first in the country to encourage new mothers to learn more about baby health and safety.	['N/A']	EN-US
1353	"Wiping tears from her eyes, Lazara Arellano de Hogue apologized yesterday and begged for forgiveness from the parents of a child who was dragged to death beneath her pickup truck nearly a year ago."	['N/A']	EN-US
1873	"THOUSANDS of jobs are at risk in Oxfordshire as a result of the Government’s approach on Brexit, a Labour MEP has warned."	['N/A']	EN-GB
2835	"HUNDREDS of skeletons could be buried beneath Oxford's Bonn Square, according to the archaeologist overseeing redevelopment work."	['N/A']	EN-GB
2602	You know Joe Lhota’s doing something right when the entire New York establishment is screaming how unfair he is.	"['new york', 'new york']"	EN-US
2062	Andy Whing is desperate to help lift the mood as Oxford United attempt to get back on track at the Kassam Stadium when in-form Southend United visit this afternoon.	['N/A']	EN-GB
2142	"Councillor Joy Andrews, Pickering mayor, is leading the welcome to the Tour de Yorkshire on behalf of the town."	['N/A']	EN-GB
1730	MANAGER John Snape hopes the consistency of Andy Gallinagh’s performances will rub off on his young players this season.	['N/A']	EN-GB
1448	"MIDDLESBROUGH have already been busy this transfer window, with Rajiv van La Parra arriving on loan from Huddersfield, George Saville turning his loan move from Millwall into a permanent transfer and Martin Braithwaite leaving to join Leganes."	['N/A']	EN-GB
51	BROMYARD-based ringmaster Chris Barltrop has celebrated the 250th anniversary of the invention of modern circus by writing a play all about it.	['N/A']	EN-GB
1575	":36 School bus full of students flips over Due to slippery conditions caused by snow, a school bus full of high school students flipped over in upstate New York. Other drivers caught the incident on camera, and several people were taken to the hospital."	['N/A']	EN-US
201	A COUPLE whose baby was almost born in a car park have thanked the paramedics who got them to hospital in the nick of time.	['N/A']	EN
2030	"COOPERSTOWN — There really was only one way Ken Griffey Jr. could go into the Hall of Fame, and always the fan favorite, he didn’t disappoint."	['N/A']	EN-US
292	"As congregants took part in the sharing of the peace ? usually a handshake ? during the bilingual Mass, dozens of relatives left their seats and embraced each other, many of them crying. Jonathan Vigliotti reports. (Published Friday, May 4, 2012)"	['N/A']	EN
2207	A woman pensioner in Abingdon was left distressed after a thief approached her from behind and snatched her handbag.	['N/A']	EN-GB
313	"TWO concerning reports in the Oxford Mail (December 30), illustrates a politically divided Oxford."	['N/A']	EN-GB
